{
  "$schema": "https://json-schema.org/draft/2020-12/schema",
  "$id": "chart_spec.schema.json",
  "title": "Chart spec (mart)",
  "description": "What build writes to data/marts/<id>.json and what ChartCard renders. Mart functions return the content fields; core fills id, page, as_of, sources, status and generated_at.",
  "type": "object",
  "required": ["id", "page", "title", "kind", "encoding", "columns", "rows", "takeaway", "assumptions", "badges", "as_of", "sources", "status", "generated_at"],
  "additionalProperties": false,
  "if": { "properties": { "kind": { "const": "combo" } }, "required": ["kind"] },
  "then": { "required": ["layers"] },
  "else": { "not": { "anyOf": [{ "required": ["layers"] }, { "required": ["panels"] }] } },
  "properties": {
    "id": { "description": "<page>.<chart>", "type": "string", "pattern": "^[a-z][a-z0-9_]*\\.[a-z][a-z0-9_]*$" },
    "page": { "type": "string", "pattern": "^[a-z][a-z0-9_]*$" },
    "title": { "type": "string", "minLength": 1 },
    "subtitle": { "type": "string" },
    "kind": { "enum": ["line", "area", "bar", "stacked_bar", "scatter", "table", "stat", "timeline", "combo"] },
    "panels": {
      "description": "Only for kind 'combo': extra panels stacked under the main one, each with its own y axis and, unless it names its own x, sharing the main x axis. encoding.y describes panel 0; panels[0] is panel 1, and so on. A layer joins a panel through its 'panel' number.",
      "type": "array",
      "minItems": 1,
      "items": {
        "type": "object",
        "required": ["label"],
        "additionalProperties": false,
        "properties": {
          "label": { "type": "string", "minLength": 1 },
          "format": { "enum": ["int", "float", "pct", "usd", "usd_compact", "multiple", "date", "text"] },
          "x": { "description": "This panel's own x axis, when it is not the main one (for example one column per model under a timeline). A rule is drawn only in panels that share the main x axis.", "$ref": "#/$defs/channel" }
        }
      }
    },
    "layers": {
      "description": "Only for kind 'combo': marks drawn over one shared x axis. A layer draws the rows whose value field is not null, so one tidy table can feed several layers.",
      "type": "array",
      "minItems": 1,
      "items": { "$ref": "#/$defs/layer" }
    },
    "encoding": {
      "type": "object",
      "additionalProperties": false,
      "properties": {
        "x": { "$ref": "#/$defs/channel" },
        "y": { "$ref": "#/$defs/channel" },
        "color": { "$ref": "#/$defs/channel" },
        "facet": { "$ref": "#/$defs/channel" }
      }
    },
    "columns": {
      "description": "Table-view and CSV columns, in order. Every row must have every column field.",
      "type": "array",
      "minItems": 1,
      "items": {
        "type": "object",
        "required": ["field", "label", "format"],
        "additionalProperties": false,
        "properties": {
          "field": { "type": "string" },
          "label": { "type": "string" },
          "format": { "enum": ["int", "float", "pct", "usd", "usd_compact", "multiple", "date", "text", "url"] }
        }
      }
    },
    "rows": { "type": "array", "items": { "type": "object" } },
    "takeaway": {
      "description": "One or two plain sentences stating what the chart shows, computed from the rows.",
      "type": "array",
      "maxItems": 2,
      "items": { "type": "string" }
    },
    "assumptions": { "description": "Shown under 'Assumptions & detail'.", "type": "array", "items": { "type": "string" } },
    "badges": {
      "description": "arithmetic = computed by us, not reported; extrapolation = projects beyond observed data.",
      "type": "array",
      "uniqueItems": true,
      "items": { "enum": ["arithmetic", "extrapolation"] }
    },
    "as_of": { "description": "Latest as_of among the rows; null when awaiting data.", "type": ["string", "null"], "format": "date" },
    "sources": { "type": "array", "minItems": 1, "items": { "$ref": "#/$defs/source_ref" } },
    "status": { "enum": ["ok", "awaiting_data"] },
    "generated_at": { "type": "string", "format": "date-time" }
  },
  "$defs": {
    "layer": {
      "description": "bar, line and point draw the field y; band shades between y_low and y_high; rule draws a vertical line at each row's x, captioned by label. series splits a layer into one colour per value of that field, otherwise name is its legend entry.",
      "type": "object",
      "required": ["mark", "name"],
      "additionalProperties": false,
      "properties": {
        "mark": { "enum": ["bar", "line", "point", "band", "rule"] },
        "name": { "type": "string", "minLength": 1 },
        "y": { "type": "string" },
        "y_low": { "type": "string" },
        "y_high": { "type": "string" },
        "label": { "type": "string" },
        "series": { "type": "string" },
        "panel": { "description": "Which panel the layer is drawn in: 0 (the default) is the main panel.", "type": "integer", "minimum": 0 }
      }
    },
    "channel": {
      "type": "object",
      "required": ["field", "type"],
      "additionalProperties": false,
      "properties": {
        "field": { "type": "string" },
        "type": { "enum": ["temporal", "quantitative", "nominal", "ordinal"] },
        "label": { "type": "string" },
        "format": { "enum": ["int", "float", "pct", "usd", "usd_compact", "multiple", "date", "text"] }
      }
    },
    "source_ref": {
      "description": "Provenance line for one source feeding the chart.",
      "type": "object",
      "required": ["source", "label", "url", "method", "tier", "cadence", "as_of", "retrieved_at", "freshness", "manual"],
      "additionalProperties": false,
      "properties": {
        "source": { "type": "string", "pattern": "^[a-z][a-z0-9_]*$" },
        "label": { "type": "string" },
        "url": { "type": "string", "pattern": "^(https?://|urn:)" },
        "method": { "enum": ["api", "scrape", "manual", "ledger"] },
        "tier": { "enum": ["company-stated", "filing", "platform", "press", "vendor", "derived"] },
        "cadence": { "enum": ["daily", "weekly", "monthly", "quarterly"] },
        "as_of": { "description": "Latest data date this source contributed.", "type": ["string", "null"], "format": "date" },
        "retrieved_at": { "description": "Latest retrieval or entry time.", "type": ["string", "null"], "format": "date-time" },
        "freshness": { "enum": ["fresh", "aging", "stale", "never"] },
        "manual": {
          "description": "Required (non-null) for manual and ledger sources that have rows.",
          "oneOf": [
            { "type": "null" },
            {
              "type": "object",
              "required": ["entered_by", "entered_at", "evidence"],
              "additionalProperties": false,
              "properties": {
                "entered_by": { "type": "string", "minLength": 1 },
                "entered_at": { "type": "string", "format": "date-time" },
                "evidence": { "type": "string", "minLength": 1 }
              }
            }
          ]
        }
      }
    }
  }
}
