{
  "title": "Intelligence Index of each company's best model",
  "subtitle": "Artificial Analysis indexes as relayed by OpenRouter's benchmarks API; the highest-scoring model per company",
  "kind": "bar",
  "encoding": {
    "x": {
      "field": "company",
      "type": "nominal",
      "label": "Company"
    },
    "y": {
      "field": "intelligence",
      "type": "quantitative",
      "label": "Intelligence Index",
      "format": "float"
    },
    "color": {
      "field": "company",
      "type": "nominal",
      "label": "Company"
    }
  },
  "columns": [
    {
      "field": "company",
      "label": "Company",
      "format": "text"
    },
    {
      "field": "model",
      "label": "Model",
      "format": "text"
    },
    {
      "field": "intelligence",
      "label": "Intelligence",
      "format": "float"
    },
    {
      "field": "coding",
      "label": "Coding",
      "format": "float"
    },
    {
      "field": "agentic",
      "label": "Agentic",
      "format": "float"
    },
    {
      "field": "date",
      "label": "Feed date",
      "format": "date"
    },
    {
      "field": "link",
      "label": "Source",
      "format": "url"
    }
  ],
  "rows": [
    {
      "company": "Anthropic",
      "model": "Claude Opus 5.5 (Max, Default Fallback)",
      "intelligence": 57.6,
      "coding": null,
      "agentic": null,
      "date": "2026-10-06",
      "link": "https://openrouter.ai/docs/api/api-reference/benchmarks/list-benchmarks"
    },
    {
      "company": "OpenAI",
      "model": "GPT-6 Astra (Max)",
      "intelligence": 52.7,
      "coding": 76.9,
      "agentic": 51.0,
      "date": "2026-10-06",
      "link": "https://openrouter.ai/docs/api/api-reference/benchmarks/list-benchmarks"
    },
    {
      "company": "xAI",
      "model": "Grok 4.7 (Xhigh)",
      "intelligence": 46.4,
      "coding": null,
      "agentic": null,
      "date": "2026-10-06",
      "link": "https://openrouter.ai/docs/api/api-reference/benchmarks/list-benchmarks"
    },
    {
      "company": "Google DeepMind",
      "model": "Gemini 3.8 Flash (High)",
      "intelligence": 40.9,
      "coding": 76.3,
      "agentic": 40.2,
      "date": "2026-10-06",
      "link": "https://openrouter.ai/docs/api/api-reference/benchmarks/list-benchmarks"
    },
    {
      "company": "Mistral AI",
      "model": "Mistral Medium 3.5",
      "intelligence": 14.2,
      "coding": 46.9,
      "agentic": 7.0,
      "date": "2026-10-06",
      "link": "https://openrouter.ai/docs/api/api-reference/benchmarks/list-benchmarks"
    },
    {
      "company": "Cohere",
      "model": "Command A+",
      "intelligence": 13.1,
      "coding": 27.8,
      "agentic": 1.0,
      "date": "2026-10-06",
      "link": "https://openrouter.ai/docs/api/api-reference/benchmarks/list-benchmarks"
    }
  ],
  "takeaway": [
    "Anthropic's Claude Opus 5.5 (Max, Default Fallback) has the highest Intelligence Index here, 57.6."
  ],
  "assumptions": [
    "Source: Artificial Analysis (artificialanalysis.ai) via OpenRouter (openrouter.ai/rankings). We relay the numbers unchanged.",
    "Selection rule: the model with the highest Intelligence Index in the feed for each company; its Coding and Agentic indexes are shown for that same model. A blank is a score the feed does not publish, not zero.",
    "Companies with no model in the feed: none. Absent means not listed on OpenRouter, or a provider prefix in config/identifiers/product.yaml that does not match."
  ],
  "badges": [],
  "id": "product.openrouter_indexes",
  "page": "product",
  "as_of": "2026-10-06",
  "sources": [
    {
      "source": "openrouter_benchmarks",
      "label": "OpenRouter benchmark feed (Artificial Analysis indexes and OpenRouter evals)",
      "url": "https://openrouter.ai/docs/api/api-reference/benchmarks/list-benchmarks",
      "method": "api",
      "tier": "platform",
      "cadence": "weekly",
      "as_of": "2026-10-06",
      "retrieved_at": "2026-10-06T03:57:28Z",
      "freshness": "fresh",
      "manual": null
    }
  ],
  "status": "ok",
  "generated_at": "2026-10-06T03:59:26Z"
}
