{
  "title": "What would change the view",
  "subtitle": "Plain rules checked every time the Briefing is built",
  "kind": "table",
  "encoding": {},
  "columns": [
    {
      "field": "rule",
      "label": "Rule",
      "format": "text"
    },
    {
      "field": "status",
      "label": "Status",
      "format": "text"
    },
    {
      "field": "now",
      "label": "Now",
      "format": "text"
    },
    {
      "field": "threshold",
      "label": "Fires when",
      "format": "text"
    }
  ],
  "rows": [
    {
      "rule": "Hacker News job posts naming Claude fall three months in a row",
      "status": "Fired",
      "now": "down 3 months in a row",
      "threshold": "3 declines in a row"
    },
    {
      "rule": "Python SDK downloads fall three months in a row",
      "status": "Clear",
      "now": "down 1 month in a row",
      "threshold": "3 declines in a row"
    },
    {
      "rule": "Open roles fall more than 15% in three months",
      "status": "Clear",
      "now": "+13% (Jul to Sep 2026)",
      "threshold": "change at or below -15%"
    },
    {
      "rule": "Claude article views sit more than 50% below their 12-month peak",
      "status": "Clear",
      "now": "44% below the 12-month peak",
      "threshold": "50% or more below the 12-month peak"
    },
    {
      "rule": "Status-page incidents rise more than 50% in three months",
      "status": "Clear",
      "now": "-31% (Jul to Sep 2026)",
      "threshold": "change at or above +50%"
    },
    {
      "rule": "The median fund marks an Anthropic share lower than three months ago",
      "status": "Clear",
      "now": "+127% (marks to 2026-07-31)",
      "threshold": "change at or below +0%"
    }
  ],
  "takeaway": [
    "1 of 6 tripwires fired: Hacker News job posts naming Claude fall three months in a row."
  ],
  "assumptions": [
    "The rules are in config/tripwires.yaml in plain terms: edit them there. Each names a signal from config/briefing.yaml.",
    "A tripwire is a prompt to look, not a forecast: a rule that fires says the signal crossed a line you chose.",
    "The latest 3 complete months against the 3 before them and the same 3 months a year earlier. Quarterly series (SEC filings) use the latest complete quarter, the weekly commit series 13 weeks, and fund marks the latest report date against one at least 60 days earlier.",
    "Every number is computed from the same sources and rules as the chart on its page. Hand-entered data is never used, and no verdict reads OpenAI: its columns are context."
  ],
  "badges": [
    "arithmetic"
  ],
  "id": "briefing.tripwires",
  "page": "briefing",
  "as_of": "2026-10-05",
  "sources": [
    {
      "source": "pypi_downloads",
      "label": "PyPI downloads (ClickHouse public PyPI dataset)",
      "url": "https://sql-clickhouse.clickhouse.com/",
      "method": "api",
      "tier": "platform",
      "cadence": "daily",
      "as_of": "2026-10-04",
      "retrieved_at": "2026-10-05T03:57:46Z",
      "freshness": "fresh",
      "manual": null
    },
    {
      "source": "npm_downloads",
      "label": "npm registry download counts",
      "url": "https://api.npmjs.org/downloads/range/2025-09-29:2026-10-04/@anthropic-ai/sdk",
      "method": "api",
      "tier": "platform",
      "cadence": "daily",
      "as_of": "2026-10-04",
      "retrieved_at": "2026-10-05T03:57:46Z",
      "freshness": "fresh",
      "manual": null
    },
    {
      "source": "github_coauthored_commits",
      "label": "GitHub commit search: public commits co-authored by Claude",
      "url": "https://github.com/search?type=commits&q=%22Co-Authored-By%3A+Claude%22+committer-date%3A2026-09-28..2026-10-04",
      "method": "api",
      "tier": "platform",
      "cadence": "weekly",
      "as_of": "2026-09-28",
      "retrieved_at": "2026-10-05T06:52:42Z",
      "freshness": "fresh",
      "manual": null
    },
    {
      "source": "wikipedia_pageviews",
      "label": "Wikimedia pageviews (English Wikipedia)",
      "url": "https://wikimedia.org/api/rest_v1/metrics/pageviews/per-article/en.wikipedia/all-access/user/Claude_%28language_model%29/daily/20260927/20261004",
      "method": "api",
      "tier": "platform",
      "cadence": "daily",
      "as_of": "2026-10-04",
      "retrieved_at": "2026-10-05T07:07:58Z",
      "freshness": "fresh",
      "manual": null
    },
    {
      "source": "hn_who_is_hiring",
      "label": "Hacker News 'Who is hiring?' threads (Algolia)",
      "url": "https://news.ycombinator.com/item?id=49522897",
      "method": "api",
      "tier": "platform",
      "cadence": "weekly",
      "as_of": "2026-09-01",
      "retrieved_at": "2026-10-05T07:49:51Z",
      "freshness": "fresh",
      "manual": null
    },
    {
      "source": "sec_filings_naming",
      "label": "SEC EDGAR full-text search (10-K and 10-Q)",
      "url": "https://www.sec.gov/Archives/edgar/data/1985554/000168316826007169/londax_i10k-053126.htm",
      "method": "api",
      "tier": "filing",
      "cadence": "weekly",
      "as_of": "2026-09-15",
      "retrieved_at": "2026-10-05T07:59:10Z",
      "freshness": "fresh",
      "manual": null
    },
    {
      "source": "ats_open_roles",
      "label": "Company job board API (Greenhouse / Ashby)",
      "url": "https://boards-api.greenhouse.io/v1/boards/anthropic/departments",
      "method": "api",
      "tier": "company-stated",
      "cadence": "daily",
      "as_of": "2026-10-05",
      "retrieved_at": "2026-10-05T04:12:39Z",
      "freshness": "fresh",
      "manual": null
    },
    {
      "source": "wayback_job_boards",
      "label": "Internet Archive captures of company job boards",
      "url": "https://web.archive.org/web/20260906161935/https://job-boards.greenhouse.io/anthropic",
      "method": "scrape",
      "tier": "company-stated",
      "cadence": "weekly",
      "as_of": "2026-09-06",
      "retrieved_at": "2026-10-05T06:59:56Z",
      "freshness": "fresh",
      "manual": null
    },
    {
      "source": "status_incidents",
      "label": "Claude status page",
      "url": "https://status.claude.com/incidents/k0h22tsvnydg",
      "method": "api",
      "tier": "company-stated",
      "cadence": "daily",
      "as_of": "2026-10-01",
      "retrieved_at": "2026-10-05T07:19:13Z",
      "freshness": "fresh",
      "manual": null
    },
    {
      "source": "sec_nport_marks",
      "label": "SEC EDGAR N-PORT-P: mutual-fund holdings of Anthropic",
      "url": "https://www.sec.gov/Archives/edgar/data/1905088/000094040026036464/primary_doc.xml",
      "method": "api",
      "tier": "filing",
      "cadence": "weekly",
      "as_of": "2026-07-31",
      "retrieved_at": "2026-10-05T07:52:42Z",
      "freshness": "fresh",
      "manual": null
    }
  ],
  "status": "ok",
  "generated_at": "2026-10-06T08:33:23Z"
}
