{
  "title": "Anthropic's SDK downloads against OpenAI's",
  "subtitle": "Growth over each 13 weeks against the 13 weeks before, for both companies; the bar is Anthropic minus OpenAI, so it is Anthropic's own part once the market is taken out.",
  "kind": "combo",
  "layers": [
    {
      "mark": "bar",
      "name": "Anthropic minus OpenAI",
      "y": "gap"
    },
    {
      "mark": "line",
      "name": "Anthropic",
      "y": "anthropic"
    },
    {
      "mark": "line",
      "name": "OpenAI",
      "y": "openai"
    }
  ],
  "encoding": {
    "x": {
      "field": "period",
      "type": "ordinal",
      "label": "13 weeks to"
    },
    "y": {
      "field": "gap",
      "type": "quantitative",
      "label": "Growth",
      "format": "pct"
    }
  },
  "columns": [
    {
      "field": "period",
      "label": "13 weeks to",
      "format": "text"
    },
    {
      "field": "gap",
      "label": "Anthropic minus OpenAI",
      "format": "pct"
    },
    {
      "field": "anthropic",
      "label": "Anthropic growth",
      "format": "pct"
    },
    {
      "field": "openai",
      "label": "OpenAI growth",
      "format": "pct"
    }
  ],
  "rows": [
    {
      "period": "Jan 2025",
      "gap": 0.13287209228038965,
      "anthropic": 0.33119034423537785,
      "openai": 0.1983182519549882
    },
    {
      "period": "Apr 2025",
      "gap": 0.7005050232817192,
      "anthropic": 0.9545136813424338,
      "openai": 0.2540086580607146
    },
    {
      "period": "Jul 2025",
      "gap": 0.08929607179173793,
      "anthropic": 0.37731226714787613,
      "openai": 0.2880161953561382
    },
    {
      "period": "Oct 2025",
      "gap": 0.4187202339506193,
      "anthropic": 0.8540668869483159,
      "openai": 0.4353466529976966
    },
    {
      "period": "Jan 2026",
      "gap": 0.020880073216944295,
      "anthropic": 0.2625876692135245,
      "openai": 0.2417075959965802
    },
    {
      "period": "Apr 2026",
      "gap": 0.5627637507613852,
      "anthropic": 1.106610555766407,
      "openai": 0.5438468050050218
    },
    {
      "period": "Jul 2026",
      "gap": 0.6850458961976809,
      "anthropic": 1.397734253203276,
      "openai": 0.7126883570055951
    },
    {
      "period": "Oct 2026",
      "gap": 0.2211109140035621,
      "anthropic": 0.43931392182159246,
      "openai": 0.21820300781803037
    }
  ],
  "takeaway": [
    "In the 13 weeks to Oct 2026 Anthropic's SDK downloads grew +44% and OpenAI's +22%; Anthropic grew faster in 8 of 8 periods.",
    "Of Anthropic's +44%, +22% is what OpenAI also saw (the market) and 22 points are Anthropic's own."
  ],
  "assumptions": [
    "A positive bar means Anthropic grew faster, or fell less, than OpenAI. Anthropic can be shrinking and still be ahead of a market that shrank more.",
    "OpenAI stands in for the market: what both companies share is market growth, and the difference is Anthropic's own.",
    "Download spikes are removed as on the Developer Adoption page (a day above 10 times the median around it). A week left with 5 or 6 clean days is scaled to 7; with fewer it is dropped.",
    "The latest 8 blocks of 13 weeks are shown, counted back from the latest complete week, so they do not line up with calendar quarters.",
    "Weeks run Monday to Sunday and only complete weeks are used.",
    "Correlation is not cause. A lead shows what moved first, not why."
  ],
  "badges": [
    "arithmetic"
  ],
  "id": "signal.vs_openai",
  "page": "signal",
  "as_of": "2026-10-04",
  "sources": [
    {
      "source": "pypi_downloads",
      "label": "PyPI downloads (ClickHouse public PyPI dataset)",
      "url": "https://sql-clickhouse.clickhouse.com/",
      "method": "api",
      "tier": "platform",
      "cadence": "daily",
      "as_of": "2026-10-04",
      "retrieved_at": "2026-10-05T03:57:46Z",
      "freshness": "fresh",
      "manual": null
    },
    {
      "source": "npm_downloads",
      "label": "npm registry download counts",
      "url": "https://api.npmjs.org/downloads/range/2025-09-29:2026-10-04/@anthropic-ai/sdk",
      "method": "api",
      "tier": "platform",
      "cadence": "daily",
      "as_of": "2026-10-04",
      "retrieved_at": "2026-10-05T03:57:46Z",
      "freshness": "fresh",
      "manual": null
    }
  ],
  "status": "ok",
  "generated_at": "2026-10-07T02:25:52Z"
}
